{
  "case_id": "GD-001",
  "source": {
    "filename": "source.jpg",
    "sha256": "0000000000000000000000000000000000000000000000000000000000000000",
    "mime_type": "image/jpeg",
    "width_px": 3024,
    "height_px": 4032,
    "provenance": "whatsapp-photo",
    "sensitive": false,
    "notes": "Example only; replace the hash and dimensions for a real local case."
  },
  "taxonomy": [
    "mild-perspective",
    "uneven-lighting",
    "jpeg-compression",
    "colored-stamp"
  ],
  "ground_truth": {
    "page_corners_px": [[240, 180], [2780, 260], [2840, 3790], [190, 3710]],
    "orientation_deg": 0,
    "deskew_deg": 0.7,
    "reference_notes": "Corners must be independently reviewed by a human."
  },
  "expected": {
    "auto_process_allowed": true,
    "manual_review_allowed": true,
    "content_reconstruction_allowed": false,
    "must_preserve_color": true,
    "must_preserve_stamp": true,
    "must_preserve_signature": false,
    "expected_failure_mode": null
  },
  "review": {
    "status": "unreviewed",
    "reviewer": "",
    "review_notes": ""
  }
}