{
  "case_id": "GD-910",
  "source": {
    "filename": "gd-910-synthetic-placeholder.png",
    "sha256": "9100000000000000000000000000000000000000000000000000000000000000",
    "mime_type": "image/png",
    "width_px": 1600,
    "height_px": 2200,
    "provenance": "synthetic",
    "sensitive": false,
    "notes": "Manifest-only bootstrap fixture. Faint/blurred content where aggressive enhancement is unsafe."
  },
  "taxonomy": [
    "focus-blur",
    "faint-stamp",
    "carbon-copy"
  ],
  "ground_truth": {
    "page_corners_px": null,
    "orientation_deg": 0,
    "deskew_deg": 0,
    "reference_notes": "Bootstrap fixture; replace with measured ground truth when a matching synthetic image is introduced."
  },
  "expected": {
    "auto_process_allowed": false,
    "manual_review_allowed": true,
    "content_reconstruction_allowed": false,
    "must_preserve_color": true,
    "must_preserve_stamp": true,
    "must_preserve_signature": false,
    "expected_failure_mode": "quality-warning"
  },
  "review": {
    "status": "approved",
    "reviewer": "bootstrap",
    "review_notes": "Synthetic manifest fixture for test coverage only."
  }
}
