{
  "case_id": "GD-905",
  "source": {
    "filename": "gd-905-synthetic-placeholder.png",
    "sha256": "9055555555555555555555555555555555555555555555555555555555555555",
    "mime_type": "image/png",
    "width_px": 1600,
    "height_px": 2200,
    "provenance": "synthetic",
    "sensitive": false,
    "notes": "Manifest-only bootstrap fixture. Weak page edge against a light background."
  },
  "taxonomy": [
    "white-on-white",
    "weak-boundary",
    "thin-lines"
  ],
  "ground_truth": {
    "page_corners_px": null,
    "orientation_deg": 0,
    "deskew_deg": 0,
    "reference_notes": "Bootstrap fixture; replace with measured ground truth when a matching synthetic image is introduced."
  },
  "expected": {
    "auto_process_allowed": false,
    "manual_review_allowed": true,
    "content_reconstruction_allowed": false,
    "must_preserve_color": false,
    "must_preserve_stamp": false,
    "must_preserve_signature": false,
    "expected_failure_mode": "manual-corners"
  },
  "review": {
    "status": "approved",
    "reviewer": "bootstrap",
    "review_notes": "Synthetic manifest fixture for test coverage only."
  }
}
